{
  "schema_version": "1",
  "tool": "wharfy",
  "version": "v0.0.0-test (0000000, 2026-06-18)",
  "start": "wharfy status",
  "state_readers": [
    "status",
    "config"
  ],
  "commands": [
    {
      "name": "agent",
      "summary": "print this capability map (read once, then drive)",
      "next": [
        "status"
      ]
    },
    {
      "name": "status",
      "summary": "what is built / signed / published, and where",
      "next": [
        "build"
      ]
    },
    {
      "name": "config",
      "summary": "show the resolved effective config",
      "next": [
        "build"
      ]
    },
    {
      "name": "auth",
      "summary": "save a credential (e.g. fury token) to the OS keychain",
      "args": "\u003ckind\u003e",
      "next": [
        "publish"
      ]
    },
    {
      "name": "init",
      "summary": "tell agents to release via wharfy (writes AGENTS.md / CLAUDE.md)",
      "next": [
        "agent"
      ]
    },
    {
      "name": "build",
      "summary": "cross-compile for every os/arch",
      "next": [
        "sign",
        "release"
      ]
    },
    {
      "name": "sign",
      "summary": "codesign macOS binaries with your identity (opt-in; skipped if none)",
      "next": [
        "release"
      ]
    },
    {
      "name": "release",
      "summary": "upload the github release (archives, packages, install.sh, latest.json)",
      "next": [
        "publish"
      ]
    },
    {
      "name": "publish",
      "summary": "push to owned channels; prepare gated ones",
      "args": "[channel]",
      "next": [
        "verify"
      ]
    },
    {
      "name": "verify",
      "summary": "install from each channel and run it"
    },
    {
      "name": "version",
      "summary": "print wharfy's own version (not your project's)",
      "next": [
        "agent"
      ]
    }
  ],
  "channels": [
    {
      "name": "homebrew",
      "kind": "owned"
    },
    {
      "name": "cask",
      "kind": "owned"
    },
    {
      "name": "scoop",
      "kind": "owned"
    },
    {
      "name": "apt",
      "kind": "owned"
    },
    {
      "name": "rpm",
      "kind": "owned"
    },
    {
      "name": "container",
      "kind": "owned"
    },
    {
      "name": "aur",
      "kind": "owned"
    },
    {
      "name": "goinstall",
      "kind": "owned"
    },
    {
      "name": "script",
      "kind": "owned"
    },
    {
      "name": "winget",
      "kind": "gated"
    },
    {
      "name": "homebrew-core",
      "kind": "gated"
    }
  ]
}
